{
  "ticket_id": "{{TICKET_ID}}",
  "ticket_title": "{{TICKET_TITLE}}",
  "ticket_url": null,
  "ticket_description": null,
  "feature_dir": "features/{{TICKET_ID}}",
  "workflow": "default",
  "current_node": "brainstorm",
  "status": "in_progress",
  "trigger": "manual",
  "started_at": "{{TIMESTAMP}}",
  "updated_at": "{{TIMESTAMP}}",
  "completed_at": null,
  "review_rounds": {
    "plan": 0,
    "spec": 0,
    "code": 0
  },
  "tasks": {
    "total": 0,
    "completed": 0,
    "in_progress": 0,
    "failed": 0,
    "items": []
  },
  "pr": {
    "url": null,
    "branch": null,
    "status": null
  },
  "escalation": {
    "active": false,
    "reason": null,
    "node": null,
    "at": null
  },
  "history": []
}
